{"content_digest":"3b31ae986f4e8b76164cc7651ed804588e8028c0141b2ba428c3808f26484069","created_at":"2026-08-31T00:00:00Z","evaluators":[{"config_id":"primary-v1","model":"frozen-synthetic-v1","model_parameters":[{"name":"temperature","value":0}],"prompt_digest":"5647f10e6d1efb24d7d937778bf5de57f0b505967e281b79b40f8606e2cee0d9","prompt_version":"1.0","provider":"offline-fixture","role":"primary","tool_permissions":["none"]},{"config_id":"shadow-a-v1","model":"frozen-synthetic-v1","model_parameters":[{"name":"temperature","value":0}],"prompt_digest":"5647f10e6d1efb24d7d937778bf5de57f0b505967e281b79b40f8606e2cee0d9","prompt_version":"1.0","provider":"offline-fixture","role":"shadow","tool_permissions":["none"]},{"config_id":"shadow-b-v1","model":"frozen-synthetic-v1","model_parameters":[{"name":"temperature","value":0}],"prompt_digest":"5647f10e6d1efb24d7d937778bf5de57f0b505967e281b79b40f8606e2cee0d9","prompt_version":"1.0","provider":"offline-fixture","role":"shadow","tool_permissions":["none"]}],"manifest_id":"edgequeue-evaluator-v1","output_schema_digest":"0a5df1d494a2ec735457a317ac4043fabdb8955d9346b1da5c72c6104b75f51b","output_schema_version":"1.0","primary_evaluator_id":"primary-v1","retry_policy":{"max_attempts":2,"retryable_outcomes":["timeout","malformed","schema_failure"]},"rubric_digest":"d35be42016f35bf8675bdee06b24e84b155d38a903e39623e1e9cd5ecd8a710f","rubric_version":"1.0","schema_version":"1.0","shadow_evaluator_ids":["shadow-a-v1","shadow-b-v1"],"smoke_result_digest":"eae3ad1e75c7026522ac33c908fcc9b9ed73d1da374c5f98cb701fb52e71c282"}
